{
    "_description": "Standard training for UCF101 video classification",
    "general":{
        "device":{
          "device_qty": 4
        },
        "num_data_workers": 2,
        "use_amp": false,
        "master_port": 9999,
        "base_seed": 0 
    },
    "dataset": {
        "root": "",
        "name": "ucf101_npz"
    },
    "model":{
         "architecture": "resnext101_ucf101",
         "pretrained": false
    },
    "training": [
        {
            "trainer_type": "normal",
            "snapshot_dir": "sample_exper_dir/ucf101/normal/resnext101_ucf101/train_model/snapshots",
            "log_dir": "sample_exper_dir/ucf101/normal/resnext101_ucf101/train_model/logs",
            "para_type": "data",
            "train_batch_size": 20,
            "epoch_qty": 400,
            "batch_sync_step": 8,
            "train_model": true,
            "optimizer": {
                "algorithm": "sgd",
                "init_lr": 0.1,
                "add_arguments": {
                    "momentum": 0.9,
                    "dampening": 0.9,
                    "weight_decay": 1e-3
                },
                "scheduler": {
                    "scheduler_type": "one_cycle",
                    "add_arguments": {
                        "max_lr": 0.1,
                        "anneal_strategy": "linear",
                        "pct_start": 0.2
                    }
                }
            }
        }
    ],
    "evaluation" : {
        "log_dir": "sample_exper_dir/ucf101/normal/resnext101_ucf101/eval_model/logs",
        "eval_batch_size": 1,
        "evaluators": [
            {
                "evaluator_name": "normal",
                "evaluator_type": "normal"
            },
            {
                "evaluator_name": "pgd eps=0.031 steps=10 (attack)",
                "evaluator_type": "attack",
                "add_arguments": {
                    "sample_qty" : 32
                },
                "attack": {
                    "attack_type": "pgd",
                    "eps": 0.031,
                    "norm": "linf",
                    "add_arguments": {
                        "alpha": 0.008,
                        "num_iters": 10,
                        "restarts": 1,
                        "start": "random"
                    }
                }
            }
        ]
    }
}
