{
    "_description": "Standard training for Librispeech speaker identification.",
    "general":{
        "device":{
            "device_qty": 4
        },
        "num_data_workers": 4,
        "use_amp": false,
        "master_port": 9999,
        "base_seed": 0 
    },
    "dataset": {
        "root": "",
        "name": "twosix_librispeech"
    },
    "model":{
         "architecture": "sincnet",
         "pretrained": true
    },
    "training": [
        {
            "trainer_type": "normal",
            "train_model": true,
            "snapshot_dir": "sample_exper_dir/twosix_librispeech/normal/sincnet/train_model/snapshots",
            "log_dir": "sample_exper_dir/twosix_librispeech/normal/sincnet/train_model/logs",
            "para_type": "data",
            "train_batch_size": 512,
            "batch_sync_step": 32,
            "epoch_qty": 30,
            "optimizer": {
                "algorithm": "sgd",
                "init_lr": 0.00005,
                "add_arguments": {
                    "momentum": 0.9,
                    "weight_decay": 1e-5
                },
                "scheduler": {
                    "scheduler_type": "one_cycle",
                    "add_arguments": {
                        "max_lr": 0.0001,
                        "pct_start": 0.3
                    }
                }
            }
        }
    ],
   "evaluation" : {
        "log_dir": "sample_exper_dir/twosix_librispeech/normal/sincnet/eval_model/logs",
        "eval_batch_size": 64,
        "evaluators": [
            {
                "evaluator_name": "normal",
                "evaluator_type": "normal"
            }
        ]
    }
}
