{
    "_description": "Standard training for CIFAR10 image classification (wide ResNet)",
    "general":{
        "device":{
          "device_qty": 1
        },
        "num_data_workers": 2,
        "use_amp": false,
        "master_port": 9999,
        "base_seed": 0 
    },
    "dataset": {
        "root": "datasets/cifar10",
        "name": "cifar10"
    },
    "model":{
        "architecture": "wideresnet28_20_cifar"
    },
    "training": [
        {
            "trainer_type": "normal",
            "snapshot_dir": "sample_exper_dir/cifar10/normal/wideresnet28_20_cifar/train_model/snapshots",
            "log_dir": "sample_exper_dir/cifar10/normal/wideresnet28_20_cifar/train_model/logs",
            "para_type": "data",
            "train_batch_size": 32,
            "epoch_qty": 50,
            "batch_sync_step": 8,
            "train_model": true,
            "optimizer": {
                "algorithm": "sgd",
                "init_lr": 0.001,
                "add_arguments": {
                    "momentum": 0.9,
                    "weight_decay": 0.256
                },
                "scheduler": {
                    "scheduler_type": "one_cycle",
                    "add_arguments": {
                        "max_lr": 0.00078,
                        "anneal_strategy": "linear",
                        "pct_start": 0.2
                    }
                }
            }
        }
    ],
    "evaluation" : {
        "log_dir": "sample_exper_dir/cifar10/normal/wideresnet28_20_cifar/eval_model/logs",
        "eval_batch_size": 32,
        "evaluators": [
            {
                "evaluator_name": "normal",
                "evaluator_type": "normal"
            }
        ]
    }
}
