{
    "_description": "Standard training for so2sat image classification",
    "general":{
        "device":{
          "device_qty": 4
        },
        "num_data_workers": 2,
        "use_amp": false,
        "master_port": 9999,
        "base_seed": 0 
    },
    "dataset": {
        "root": "/hdd2/datasets/so2sat_npz/",
        "name": "so2sat_npz"
    },
    "model":{
         "architecture": "resnet18_cifar",
         "add_arguments": { 
            "num_input_channels" : 14
         },
         "pretrained": true
    },
    "training": [
        {
            "trainer_type": "normal",
            "snapshot_dir": "sample_exper_dir/so2sat/normal/resnet18/train_model/snapshots",
            "log_dir": "sample_exper_dir/so2sat/normal/resnet18/train_model/logs",
            "para_type": "data",
            "train_batch_size": 512,
            "epoch_qty": 30,
            "batch_sync_step": 8,
            "train_model": true,
            "optimizer": {
                "algorithm": "sgd",
                "init_lr": 0.001,
                "add_arguments": {
                    "momentum": 0.9,
                    "weight_decay": 0.256
                },
                "scheduler": {
                    "scheduler_type": "one_cycle",
                    "add_arguments": {
                        "max_lr": 0.00078,
                        "anneal_strategy": "linear",
                        "pct_start": 0.2
                    }
                }
            }
        }
    ],
    "evaluation" : {
        "log_dir": "sample_exper_dir/so2sat/normal/resnet18/eval_model/logs",
        "eval_batch_size": 64,
        "evaluators": [
            {
                "evaluator_name": "normal",
                "evaluator_type": "normal"
            }
        ]
    }
}
